{
  "artifact_digest": "e74bea13b2caef03df42ff6defa798c8be1903251e4d508a4a288c631351fc06",
  "artifact_type": "public_delivery.qcs_receipt",
  "authority": {
    "deployment_allowed": false,
    "paper_allowed": false,
    "real_allowed": false
  },
  "payload": {
    "advisory_only": true,
    "owner_evidence": [
      "package_verification",
      "release_verdict"
    ]
  },
  "producer": "public_qcs",
  "schema_version": "quantengine_public.delivery_artifact.v1",
  "status": "PASS",
  "upstream": [
    {
      "artifact_digest": "ebd7ad8675dc329703ee8deb7a9e1a64ed9d0a2695b6c172b6f85016b9672e4d",
      "artifact_type": "public_delivery.qcs_manifest"
    },
    {
      "artifact_digest": "378bbbf2e3c18959ffb9d0607a9a343e1f4460c38743b7191c4df2d93f2fe533",
      "artifact_type": "public_delivery.test_result"
    }
  ]
}
