{
  "artifact_digest": "09e997a374aa75fb3e7c259506c0bb9627e8a3b9d9f0e17a9a9fb5a61fb499ff",
  "artifact_type": "public_delivery.qcs_receipt",
  "authority": {
    "deployment_allowed": false,
    "paper_allowed": false,
    "real_allowed": false
  },
  "payload": {
    "advisory_only": true,
    "owner_evidence": [
      "package_verification",
      "release_verdict"
    ]
  },
  "producer": "public_qcs",
  "schema_version": "quantengine_public.delivery_artifact.v1",
  "status": "PASS",
  "upstream": [
    {
      "artifact_digest": "3de7e66302f61edcc715dde74e67cfd62aca4b212d604bdd0a5a4beaddccafa0",
      "artifact_type": "public_delivery.qcs_manifest"
    },
    {
      "artifact_digest": "dd7708160de0fe981db73292bba9d99638b0797cb1ed1b09e7ea7ecafc0e7652",
      "artifact_type": "public_delivery.runtime_evidence"
    },
    {
      "artifact_digest": "378bbbf2e3c18959ffb9d0607a9a343e1f4460c38743b7191c4df2d93f2fe533",
      "artifact_type": "public_delivery.test_result"
    }
  ]
}
