{
  "artifact_digest": "8f05d66ab6b74c77b3f630d2b79d66e0d70450e40ef8a6d4db8498281c36b162",
  "artifact_type": "public_delivery.quality_verdict",
  "authority": {
    "deployment_allowed": false,
    "paper_allowed": false,
    "real_allowed": false
  },
  "payload": {
    "closed_world": true,
    "provenance_matches": true
  },
  "producer": "public_quality_shield",
  "schema_version": "quantengine_public.delivery_artifact.v1",
  "status": "PASS",
  "upstream": [
    {
      "artifact_digest": "09e997a374aa75fb3e7c259506c0bb9627e8a3b9d9f0e17a9a9fb5a61fb499ff",
      "artifact_type": "public_delivery.qcs_receipt"
    },
    {
      "artifact_digest": "dd7708160de0fe981db73292bba9d99638b0797cb1ed1b09e7ea7ecafc0e7652",
      "artifact_type": "public_delivery.runtime_evidence"
    },
    {
      "artifact_digest": "378bbbf2e3c18959ffb9d0607a9a343e1f4460c38743b7191c4df2d93f2fe533",
      "artifact_type": "public_delivery.test_result"
    },
    {
      "artifact_digest": "2a92d47ee3a0f04e10959dfb21aa2a564e92705f62d5e8c9b58711e5207466f2",
      "artifact_type": "public_delivery.ops_plan"
    }
  ]
}
