{
  "artifact_digest": "deef21fba596be229aeb9af81319f40d49bde2a3bdb065240fdff76235a0d358",
  "artifact_type": "public_delivery.quality_verdict",
  "authority": {
    "deployment_allowed": false,
    "paper_allowed": false,
    "real_allowed": false
  },
  "payload": {
    "closed_world": true,
    "provenance_matches": true
  },
  "producer": "public_quality_shield",
  "schema_version": "quantengine_public.delivery_artifact.v1",
  "status": "PASS",
  "upstream": [
    {
      "artifact_digest": "e74bea13b2caef03df42ff6defa798c8be1903251e4d508a4a288c631351fc06",
      "artifact_type": "public_delivery.qcs_receipt"
    },
    {
      "artifact_digest": "378bbbf2e3c18959ffb9d0607a9a343e1f4460c38743b7191c4df2d93f2fe533",
      "artifact_type": "public_delivery.test_result"
    },
    {
      "artifact_digest": "2a92d47ee3a0f04e10959dfb21aa2a564e92705f62d5e8c9b58711e5207466f2",
      "artifact_type": "public_delivery.ops_plan"
    }
  ]
}
